message,task
Let's connect tomorrow at 8 PM.,Connect with <PERSON> tomorrow at 8 PM.
Send me the updates on project by Thursday.,Send project updates to <PERSON> by Thursday.
Can you follow up with the backend team?,Follow up with backend team <PERSON>.
Schedule a call with the manager.,Schedule call with <PERSON>.
Remind me to review the code by evening.,Remind <PERSON> to review code by evening.
Update client on this.,Update client <PERSON>.
Let's plan the meeting tomorrow.,Plan meeting with <PERSON> tomorrow.
Ask John for the latest report.,Ask John for latest report.
We should discuss this next week.,Discuss with <PERSON> next week.
"No issues here, everything is fine.",
"Hey, what’s the progress on this?",
Let’s finalize the draft today.,Finalize draft with <PERSON> today.
Follow up on shipment status.,Follow up on shipment status with <PERSON>.
Ping the client for approval.,Ping client <PERSON> for approval.
Can we reschedule the meeting?,Reschedule meeting with <PERSON>.
Keep me posted about the updates.,
Check backend readiness Monday.,Check backend readiness Monday with <PERSON>.
Let's connect later this evening.,Connect with <PERSON> later this evening.
I’ll handle this myself.,
Prepare presentation by 5 PM.,Prepare presentation with <PERSON> by 5 PM.
Book a cab for tomorrow morning.,Book cab for <PERSON> tomorrow morning.
Inform the HR about the candidate’s arrival.,Inform HR <PERSON> about candidate’s arrival.
Share the meeting notes after the call.,Share meeting notes with <PERSON> after the call.
Don’t forget to check the server logs.,Check server logs with <PERSON>.
Arrange a discussion on Friday.,Arrange discussion with <PERSON> on Friday.
Ask the designer for new mockups.,Ask designer <PERSON> for new mockups.
Please verify the client payment status.,Verify client payment status with <PERSON>.
No action needed from my side.,
Update the document and upload to drive.,Update document with <PERSON> and upload to drive.
Can we talk about next sprint tomorrow?,Talk about next sprint with <PERSON> tomorrow.
Submit the final report today.,Submit final report with <PERSON> today.
"Everything is on track, good job!",
Remind the QA team for testing.,Remind QA team <PERSON> for testing.
We should send the invoice by Monday.,Send invoice to <PERSON> by Monday.
Let’s meet at the office in an hour.,Meet with <PERSON> at office in an hour.
Ping Raj for deployment details.,Ping Raj for deployment details.
Schedule a catch-up with the marketing team.,Schedule catch-up with marketing team <PERSON>.
Reschedule demo to Wednesday.,Reschedule demo with <PERSON> to Wednesday.
Ask finance to approve budget.,Ask finance <PERSON> to approve budget.
Check status of API integration.,Check API integration status with <PERSON>.
Let's finalize content plan tomorrow.,Finalize content plan with <PERSON> tomorrow.
Remind me about client feedback call.,Remind <PERSON> about client feedback call.
Send calendar invite for review.,Send calendar invite to <PERSON> for review.
Let’s have lunch together tomorrow.,Lunch with <PERSON> tomorrow.
Please deploy new code changes.,Deploy new code changes with <PERSON>.
I think we are done for today.,
Follow up with vendor for delivery.,Follow up with vendor <PERSON> for delivery.
Update presentation slides before 3 PM.,Update presentation slides with <PERSON> before 3 PM.
Remind support team for ticket resolution.,Remind support team <PERSON> for ticket resolution.
Confirm meeting location.,Confirm meeting location with <PERSON>.
Please confirm attendance for the workshop.,Confirm attendance of <PERSON> for workshop.
Update timeline for phase 2.,Update phase 2 timeline with <PERSON>.
Ping team for daily updates.,Ping team <PERSON> for daily updates.
Share credentials with the new intern.,Share credentials with <PERSON> new intern.
Let’s catch up on project milestones.,Catch up with <PERSON> on project milestones.
Ask for the analytics report.,Ask <PERSON> for analytics report.
Please complete the documentation by end of day.,Complete documentation with <PERSON> by end of day.
Book hotel for conference next week.,Book hotel for <PERSON> for conference next week.
No changes required for now.,
Remind marketing team about social posts.,Remind marketing team <PERSON> about social posts.
Ask designer to prepare banner graphics.,Ask designer <PERSON> to prepare banner graphics.
Discuss project delays in the next meeting.,Discuss project delays with <PERSON> in next meeting.
Let’s review sprint backlog today.,Review sprint backlog with <PERSON> today.
Remind me to email vendor tomorrow.,Remind <PERSON> to email vendor tomorrow.
Send invoice for payment today.,Send invoice to <PERSON> for payment today.
Prepare the agenda for Monday's meeting.,Prepare agenda with <PERSON> for Monday's meeting.
Update HR about the new joining date.,Update HR <PERSON> about new joining date.
Resend credentials to the admin.,Resend credentials to admin <PERSON>.
Follow up on yesterday’s issue.,Follow up on yesterday’s issue with <PERSON>.
Check with operations for shipment status.,Check shipment status with operations <PERSON>.
Notify users about downtime.,Notify users <PERSON> about downtime.
Arrange meeting with legal team tomorrow.,Arrange meeting with legal team <PERSON> tomorrow.
Ping QA for regression testing results.,Ping QA <PERSON> for regression testing results.
Ask finance for updated budget.,Ask finance <PERSON> for updated budget.
Please update CRM with new client data.,Update CRM with <PERSON> with new client data.
We should check the app performance.,Check app performance with <PERSON>.
Remind the developer about pending PR.,Remind developer <PERSON> about pending PR.
Send the proposal to marketing.,Send proposal to marketing <PERSON>.
Call the client to finalize budget.,Call client <PERSON> to finalize budget.
Schedule code review session.,Schedule code review session with <PERSON>.
Let’s finalize wireframes today evening.,Finalize wireframes with <PERSON> today evening.
Update product catalog before weekend.,Update product catalog with <PERSON> before weekend.
Notify admin about the access request.,Notify admin <PERSON> about access request.
Share test results with management.,Share test results with management <PERSON>.
Please check with support about ticket #1234.,Check ticket #1234 with support <PERSON>.
Can we plan a team lunch next week?,Plan team lunch with <PERSON> next week.
Remind designer about logo submission.,Remind designer <PERSON> about logo submission.
Ask intern to update spreadsheet.,Ask intern <PERSON> to update spreadsheet.
Prepare monthly report by Friday.,Prepare monthly report with <PERSON> by Friday.
Follow up with sales on leads.,Follow up with sales <PERSON> on leads.
No update from my side.,
Can we close this task today?,Close this task with <PERSON> today.
Ping Rajeev for approval on marketing plan.,Ping Rajeev for approval on marketing plan.
Update code documentation this week.,Update code documentation with <PERSON> this week.
Send reminder for feedback collection.,Send reminder to <PERSON> for feedback collection.
Discuss team roadmap on Monday.,Discuss team roadmap with <PERSON> on Monday.
Schedule interview for new designer.,Schedule interview for new designer <PERSON>.
Confirm logistics for upcoming event.,Confirm logistics with <PERSON> for upcoming event.
Remind me to check the API logs later.,Remind <PERSON> to check API logs later.
Finalize travel arrangements.,Finalize travel arrangements with <PERSON>.
